{
  "studyKey": "synthetic:trade-validator-v2",
  "studyVersion": 1,
  "mechanismFamily": "trade",
  "studyVariant": "graph_cluster_role_2x2_encouragement",
  "protocolKey": "commitments-causal-identification-and-calibration-master-v2",
  "protocolPayloadHash": "sha256:cd663ae722ee028ddfe3e1b866acab9ef79b5fcf5b5418d053bd3687eca3881a",
  "templateKey": "commitments-trade-study-template-v2",
  "templatePayloadHash": "sha256:cf0a7a96294b431dcd79879fa01b7d1031ea50a842cebca6986e13351bcbb1e1",
  "evidenceToProductMappingHash": "sha256:eb4aadae8491c1a6924fca03acdeb9157b07a1439098e736c88e549db16b59b8",
  "studyInstanceSchemaHash": "sha256:a8650788ed3e0ab6749dcd86342fd9c39dfc829ec23a4afe00d34bd28fa2a859",
  "eligiblePopulationSnapshotHash": "sha256:8e670d422de33998f10d4767a240664c37e3ad1ad173fd1283d08fb5b2e11666",
  "eligibilityRules": [
    "synthetic directed dyad is frozen before assignment",
    "both synthetic roles satisfy the template eligibility rule"
  ],
  "exclusionRules": [
    "exclude any fixture containing a non-synthetic identifier"
  ],
  "assignmentUnit": "pre-randomization graph cluster",
  "exposureUnit": "frozen eligible directed dyad opportunity",
  "outcomeUnit": "frozen dyad outcome",
  "analysisUnit": "independent randomized graph cluster",
  "interferenceClusterDefinition": "synthetic connected components are frozen before assignment",
  "assignmentDesign": "four-arm cluster-randomized bilateral encouragement fixture",
  "assignmentProbabilities": [
    {
      "armKey": "neither_role",
      "probability": "0.25"
    },
    {
      "armKey": "role_a_only",
      "probability": "0.25"
    },
    {
      "armKey": "role_b_only",
      "probability": "0.25"
    },
    {
      "armKey": "both_roles",
      "probability": "0.25"
    }
  ],
  "blockingAndStratificationVariables": [
    "synthetic_cluster_size_band"
  ],
  "exposureMapping": "map assigned bilateral arm and observed synthetic delivery into one registered exposure cell",
  "supportedExposureCells": [
    "neither_role",
    "role_a_only",
    "role_b_only",
    "both_roles"
  ],
  "emptyExposureCellAction": "no_launch",
  "primaryEstimand": {
    "estimandKey": "bilateral_encouragement_policy_itt",
    "estimandType": "assignment_policy_itt",
    "claimScope": "policy_level"
  },
  "potentialOutcomeContrast": "mean reviewed synthetic outcome under both_roles minus mean under neither_role",
  "targetPopulation": "the frozen synthetic directed-dyad fixture population only",
  "primaryOutcome": {
    "outcomeKey": "counterparty_native_units",
    "outcomeKind": "scalar_native_unit",
    "nativeUnit": "synthetic_action_unit",
    "role": "primary"
  },
  "outcomeRegistry": [
    {
      "outcomeKey": "counterparty_native_units",
      "outcomeKind": "scalar_native_unit",
      "nativeUnit": "synthetic_action_unit",
      "role": "primary"
    },
    {
      "outcomeKey": "platform_cost",
      "outcomeKind": "scalar_native_unit",
      "nativeUnit": "synthetic_currency_unit",
      "role": "safety_cost"
    }
  ],
  "outcomeWindow": "synthetic fixture resolution window",
  "estimator": {
    "estimatorKey": "cluster_hajek_itt",
    "family": "cluster-level Horvitz-Thompson or Hájek with randomization inference",
    "designBased": true
  },
  "varianceProcedure": {
    "procedureKey": "cluster_randomization_variance",
    "designBased": true
  },
  "finiteSampleInference": {
    "methodKey": "exact_cluster_randomization_test",
    "randomizationBased": true
  },
  "unequalClusterSizeHandling": "use frozen cluster weights and report sensitivity to the largest cluster",
  "covariateAdjustmentPolicy": "precision-only adjustment frozen before assignment",
  "missingnessEstimand": "treat unresolved synthetic evidence as a separate outcome state",
  "attritionBounds": "report worst-case arm-specific bounds",
  "sensitivityAnalyses": [
    "exclude each synthetic cluster in turn",
    "reclassify unresolved outcomes at both bounds"
  ],
  "graphDiagnostics": {
    "status": "required_not_completed",
    "noLaunchIfInadequate": true
  },
  "precisionSimulation": {
    "status": "required_not_completed",
    "noLaunchDetermination": "not_assessed"
  },
  "fixedHorizonOrSequentialDesign": "fixed synthetic horizon; no optional stopping",
  "ethicsDetermination": {
    "status": "required_not_completed",
    "independentRequired": true,
    "gatekeeperPermissionIsConsent": false
  },
  "participantDefinition": "no real participant; synthetic QA fixture only",
  "consentOrWaiver": {
    "status": "not_determined",
    "independentlyApproved": false
  },
  "controlConditionJustification": "synthetic control arm exists solely to test the registry contract",
  "vulnerableParticipantProtections": "no real people or vulnerable groups may enter the fixture",
  "debriefingPolicy": "not applicable to synthetic fixtures",
  "adverseEventMonitoring": "record every synthetic safety signal as a blocking veto",
  "stopAndSuspensionRules": [
    "cancel the fixture after any observed or unresolved safety veto"
  ],
  "privacyRetentionAndDeletion": "retain only synthetic keys and synthetic evidence references in QA",
  "accessControl": "service-role RPC writes only; no direct table writes",
  "incidentResponse": "cancel the fixture and preserve append-only evidence if a boundary fails",
  "entropySource": "synthetic deterministic fixture seed only",
  "seedGenerationProcedure": "hash the frozen synthetic fixture manifest",
  "seedCommitment": "sha256:1b4f36e5993cbbaeef4b203b9ed799dd6e215ac85ec76ec74f776a55ccf48e0c",
  "constrainedRandomizationRule": "accept only the four exact arms with equal frozen probabilities",
  "assignmentConcealment": "fixture assignments remain unavailable outside the QA service role",
  "outcomeAdjudicatorBlinding": "synthetic adjudication fixture is blind to arm labels",
  "unblindingLog": [],
  "postAssignmentEligibilityChangeLog": [],
  "differentialEvidenceResolutionAudit": "compare synthetic resolution states by arm",
  "blockingSafetyOutcomes": [
    "harmful_offer_or_threat",
    "baseline_manufacture_or_worsening",
    "harm_shifted_to_nonparticipants",
    "coercion_harassment_identity_exposure_or_retaliation",
    "concentration_or_exclusion_effect",
    "off_platform_substitution",
    "duplicate_or_overlapping_resource_claim"
  ],
  "contaminationAndSpilloverMonitoring": "record synthetic cross-cluster contamination and spillover flags",
  "offPlatformSubstitutionAudit": "synthetic fixture has no off-platform activity",
  "resourceClaimDeduplication": "one synthetic claim key may appear in at most one additive record",
  "evidenceReferenceSchemes": [
    "qa-evidence://synthetic/"
  ],
  "assignmentCodeHash": "sha256:041205ed14c4d42f53e7b54c59d437f7e1013137d229331ec5bce005cd223c14",
  "analysisCodeHash": "sha256:3319e6517ad0a8e2e63955e735b00848dcae185af34c99fac38009caf3c87447",
  "studyInstancePayloadHash": "sha256:ee908f56d3ad6ccf3a6b6e034bef856e96e2bfb833a6d379b6bcbd30cd730212",
  "appendOnlyRegistryRecord": "qa-registry://synthetic/trade-validator-v2",
  "protectedTagOrEquivalent": "github://ghuser29384/Website2/commit/f93acc33c135f34bc28f006842d9e08120d5b859",
  "amendmentLog": [],
  "deviationLog": [],
  "instrumentationEnvironment": "qa",
  "subjectMode": "synthetic_only",
  "executionAuthorized": false,
  "realUserAssignmentAllowed": false
}
